{
  "schema_version": "1.0",
  "execution_id": "DF4B-DEMO-INSPECTION-001",
  "task_id": "DF4B-DEMO-INSPECTION",
  "workspace_id": "df4b-demo-inspection",
  "allowed_action_classes": ["inspection", "validation"],
  "operations": [
    {
      "operation_id": "inspect-guide",
      "operation": "inspect_file",
      "path": "docs/engineering/lia-isolation-and-owner-guide.md",
      "paths": [],
      "text": null,
      "expected_text": null,
      "replacement_text": null,
      "resource_type": "documentation",
      "resource_id": "df4b-inspection"
    }
  ],
  "validation_selections": ["architecture"],
  "termination_policy": {
    "maximum_operations": 3,
    "maximum_mutations": 1,
    "maximum_files_inspected": 5,
    "maximum_files_changed": 1,
    "maximum_output_record_bytes": 1000000,
    "maximum_validation_selections": 1,
    "execution_timeout_seconds": 300
  },
  "required_report_fields": [
    "state_history",
    "files_inspected",
    "validation_results",
    "blockers",
    "action_audit"
  ]
}
